{
  "trace_version": "1.0",
  "loop_id": "demo-reflection-001",
  "loop_name": "reflection-example",
  "spec_path": "examples/reflection-loop/specs/runtime-minimal.yaml",
  "started_at": "2026-06-25T12:00:00Z",
  "ended_at": "2026-06-25T12:00:04Z",
  "success": true,
  "termination_reason": "quality_threshold_met",
  "total_cost_usd": 0.08,
  "iterations": [
    {
      "iteration": 0,
      "timestamp": "2026-06-25T12:00:01Z",
      "worker_id": "writer",
      "worker_output": "Draft summary of loop engineering principles.",
      "evaluator_scores": { "quality": 0.72 },
      "cost_usd": 0.03,
      "feedback": ["Add concrete example"]
    },
    {
      "iteration": 1,
      "timestamp": "2026-06-25T12:00:03Z",
      "worker_id": "writer",
      "worker_output": "Revised summary with feedback-loop example.",
      "evaluator_scores": { "quality": 0.86 },
      "cost_usd": 0.05
    }
  ],
  "metadata": {
    "runtime": "generic/loop_runtime",
    "seed": 42
  }
}
